track_id,track_name,artist_name,played_at,danceability,energy,key,loudness,mode,speechiness,acousticness,instrumentalness,liveness,valence,tempo,type,id,uri,track_href,analysis_url,duration_ms,time_signature,lyrics
0bx6v84HtmEYFRBAOvDTgk,Your Love (Déjà Vu),Glass Animals,2024-10-28T20:32:03.397Z,0.851,0.663,7,-7.168,1,0.0532,0.0167,0.363,0.103,0.605,108.004,audio_features,0bx6v84HtmEYFRBAOvDTgk,spotify:track:0bx6v84HtmEYFRBAOvDTgk,https://api.spotify.com/v1/tracks/0bx6v84HtmEYFRBAOvDTgk,https://api.spotify.com/v1/audio-analysis/0bx6v84HtmEYFRBAOvDTgk,234372,4,"Producers

How to Format Lyrics:
To learn more, check out our transcription guide or visit our transcribers forum
“Your Love (Déjà Vu),” described by band frontman Dave Bayley as a “conflicted booty-call anthem,” is about toxic relationships that you know are bad for you but can’t seem to cut off.
Speaking to Annie Mac during the song’s premiere on BBC Radio 1’s Future Sounds, the band’s lead singer and songwriter Dave Bayley explained that he has recently made a major shift from the band’s usual abstract lyrics to more personal ones. He went on to explain that “Your Love” is about a dysfunctional relationship and stated:
“[E]veryone’s got relationships, not necessarily romantic ones, in their lives and they know that that person is kind of bad; it’s an unhealthy relationship – but you keep letting that person back into your life. Either because you think it’s going to change, or because something deeper, darker – you’re addicted to the chaos of that relationship. That’s what this is about – being addicted to the mess.”
Naturally, much of this interview focused on the elephant in the room: drummer Joe Seaward’s life-threatening cycling accident which left him unable to walk or speak–much less play drums–for over a year. His injuries forced Glass Animals to cancel all scheduled tour dates and take an extended hiatus. Initially, the band stayed with him for several weeks. Eventually as Joe’s healing progressed Dave went to the United States where he worked on some solo and collaborative writing and producing projects. He said that working with hip-hop artists who tended to write very personal lyrics inspired him to take a more personal approach to songwriting as well. Thus, the incident that threatened to destroy the band ended up being a catalyst for creative change.
The song first made its live debut during Glass Animals' comeback show at The Bullingdon in late 2019 where the setlist called it “Palm Mute”. Fans in attendance reported that the band  requested for them not to post any videos of this performance online as they were still a bit rusty. They honored the request.
“Your Love (Déjà Vu)” was confirmed to be a single from Glass Animals' upcoming third album, Dreamland, before the album was officially announced.
Find answers to frequently asked questions about the song and explore its deeper meaning
Dave’s quotes in Dork Magazine expand on the song’s subject:
“I think we’ve all found ourselves in fucked up relationships that make us feel sad and helpless. Not necessarily something romantic – maybe it’s with a family member or a friend. A relationship that we know on some level is going to keep breaking our hearts. We let that person back into their [sic] lives over and over again, even though it always ends the same. Maybe you don’t confront it because you hope it’ll change with time. Or because it’s easier to let it slide and never set boundaries. maybe you think you deserve that unhappiness. Or maybe you find some strange comfort in the chaos.
This song is about that…about being addicted to chaos. About doing or allowing something self-destructive because on some level you get off on the sadness that comes of it. It’s about wanting to float around and exist inside of that feeling because it has always been familiar to you. It’s something that a lot of people know from growing up in a tense household…so it can feel right to create that dynamic, even if you don’t realise you’re doing it.”
Glass Animals explained it with a tweet
…it’s two identical takes. one with a thermal camera. one normal. layered on top of each other. i have a bath. and then i sit in a car even tho i don’t actually have a driving license. and we dance around.



"
3SAga35lAPYdjj3qyfEsCF,Feel It - From The Original Series “Invincible”,d4vd,2024-10-28T20:25:14.866Z,0.565,0.593,8,-5.864,1,0.0883,0.0288,0.0,0.215,0.429,120.509,audio_features,3SAga35lAPYdjj3qyfEsCF,spotify:track:3SAga35lAPYdjj3qyfEsCF,https://api.spotify.com/v1/tracks/3SAga35lAPYdjj3qyfEsCF,https://api.spotify.com/v1/audio-analysis/3SAga35lAPYdjj3qyfEsCF,157974,4,
26E2fb3lp8MUEHq1WagF5f,Domestic Bliss,Glass Animals,2024-10-28T07:42:41.556Z,0.657,0.357,9,-10.922,0,0.0699,0.708,8.28e-06,0.0803,0.336,114.994,audio_features,26E2fb3lp8MUEHq1WagF5f,spotify:track:26E2fb3lp8MUEHq1WagF5f,https://api.spotify.com/v1/tracks/26E2fb3lp8MUEHq1WagF5f,https://api.spotify.com/v1/audio-analysis/26E2fb3lp8MUEHq1WagF5f,198035,4,"Producer

How to Format Lyrics:
To learn more, check out our transcription guide or visit our transcribers forum
“Domestic Bliss” narrates a tragic instance of an abusive relationship the mother of one of Dave Bayley’s childhood friends was in.
In an interview with NME, Bayley said:
I was too young to understand why she had blood on her nose…It was one of the toughest to write because it didn’t feel like my story to tell, but it also felt like a story that needed to be told. At the moment, in the current climate where domestic violence has risen so dramatically under lockdown, it’s a topic that feels more important than ever to talk about.
Find answers to frequently asked questions about the song and explore its deeper meaning
From an interview with NME :
‘One of the songs from the new album, ‘Domestic Bliss’, for example, relays a story about his friend’s mother in an abusive relationship.
“I was too young to understand why she had blood on her nose,” Bayley recalls of the harrowing moment. “It was one of the toughest to write because it didn’t feel like my story to tell, but it also felt like a story that needed to be told.“’
Dave for Apple Music:
This song was sparked by one of my very first memories—the first where I can trace the whole sequence of events. I was maybe six. I went to my friend’s house after school one day, and it was a weird place. There were dogs in cages, wild cats in cages; I didn’t really understand it. We weren’t allowed in the house—we always played in this woodsy area nearby—but sometimes there’d be loud shouting from inside. My friend would turn to me and be like, ‘Oh god, she’s going to come out crying.’ And his mom would come out of the house in tears with blood on her nose and things like that. I remember it hitting me, just that it was so bad. And then we’d all get back in the truck and she’d take me home. I guess the song is about the helplessness you feel in situations like that. When you know it’s bad but also that you’re too young to really get it."
5GWdbUP56UBrpkkWpitLTG,((home movie: rockets)),Glass Animals,2024-10-28T06:42:17.076Z,0.397,0.275,0,-13.43,1,0.0363,0.0438,0.156,0.437,0.122,119.86,audio_features,5GWdbUP56UBrpkkWpitLTG,spotify:track:5GWdbUP56UBrpkkWpitLTG,https://api.spotify.com/v1/tracks/5GWdbUP56UBrpkkWpitLTG,https://api.spotify.com/v1/audio-analysis/5GWdbUP56UBrpkkWpitLTG,60123,4,"Producer

How to Format Lyrics:
To learn more, check out our transcription guide or visit our transcribers forum
I’m pretty sure the almost seamless transition between the final chord of this song and the one in Domestic Bliss was intentional, as well as the meaning of the placement. This is what I assume to be another one of Dave’s home movies. It’s a sweet memory of his childhood, the accompanying video being a little moment of happiness and spending time with his parents as a young kid. That’s what makes the next track seem more bitter and less hopeful. The narrator in Domestic Bliss’s lyrics seems to be a sort of shadow, a warning that not every story is as simplistic and cheerful as the others. And that pain is often glamourized and ignored until it’s too late.
Find answers to frequently asked questions about the song and explore its deeper meaning"
7jbDqjzkpjfUytnqG6zxO3,It’s All So Incredibly Loud,Glass Animals,2024-10-28T06:41:16.812Z,0.394,0.278,1,-13.28,0,0.033,0.598,0.169,0.0689,0.121,106.989,audio_features,7jbDqjzkpjfUytnqG6zxO3,spotify:track:7jbDqjzkpjfUytnqG6zxO3,https://api.spotify.com/v1/tracks/7jbDqjzkpjfUytnqG6zxO3,https://api.spotify.com/v1/audio-analysis/7jbDqjzkpjfUytnqG6zxO3,259060,4,"Producer

How to Format Lyrics:
To learn more, check out our transcription guide or visit our transcribers forum
From FLOOD magazine, frontman Dave Bayley explained, “If you’ve ever said something that you know is going to break that person, then you say it, and it’s almost like an out-of-body experience, and it feels like it’s not you saying it…but then it comes out,” says Bayley. “It’s about the three seconds between you saying it, and then there’s that silence—but it’s also the loudest thing that’s ever happened in your life.”
Find answers to frequently asked questions about the song and explore its deeper meaning
From the band’s Instagram post:
This entire song is about only three seconds of life. I think most people have been in a position where they have to say something to someone that they know is going to devastate them and change their life forever. It’s about the silence between those words leaving your mouth, and their reaction as those words register and the full weight rolls over them…until they say something back. its probably the most deafening thing I’ve ever experienced. the video is meant to be a physical representation of the build up before that and then the sudden explosion of quiet that seems to last forever.
From the album’s Apple Music page:
This song is about saying something that you know is going to really hurt somebody—something they’ll never forgive you for and that will probably make them hate you—and the three seconds right after you say those words. That silence that feels like the loudest fucking thing ever. I began with a particular moment in mind, but then I just started thinking back on all the times I’ve been…well, maybe not a dick, but close. All the times I’ve hurt somebody, and sitting with what that felt like. It’s quite abstract compared to the rest of the songs on the record because I wanted it to apply to a lot of situations."
7s0FCUlKnSFjFPzcIJmkwo,Waterfalls Coming Out Your Mouth,Glass Animals,2024-10-28T06:36:27.226Z,0.649,0.553,11,-7.139,0,0.034,0.194,0.000553,0.178,0.322,149.004,audio_features,7s0FCUlKnSFjFPzcIJmkwo,spotify:track:7s0FCUlKnSFjFPzcIJmkwo,https://api.spotify.com/v1/tracks/7s0FCUlKnSFjFPzcIJmkwo,https://api.spotify.com/v1/audio-analysis/7s0FCUlKnSFjFPzcIJmkwo,161790,4,"Producer

How to Format Lyrics:
To learn more, check out our transcription guide or visit our transcribers forum
“Waterfalls Coming Out Your Mouth” is about looking back at yourself at the beginning of a relationship and recognising that you were acting completely different to normal. The song was the first to be written for Dreamland after it’s title track. The final version is actually the demo, as the band had tried to re-record it, but ended up sticking with the original.
In the Glass Animals listening party, Bayley says
Someone once told me that for the first 3 months of a relationship, you play a fake version of yourself…I think we spend a lot of time not being ourselves because we think who we are isn’t good enough, so we hide our real selves when actually it would be much better to just be open and honest from the beginning.
Find answers to frequently asked questions about the song and explore its deeper meaning"
