track_id,track_name,artist_name,played_at,danceability,energy,key,loudness,mode,speechiness,acousticness,instrumentalness,liveness,valence,tempo,type,id,uri,track_href,analysis_url,duration_ms,time_signature,lyrics
0bx6v84HtmEYFRBAOvDTgk,Your Love (Déjà Vu),Glass Animals,2024-11-21T04:17:58.527Z,0.851,0.663,7,-7.168,1,0.0532,0.0167,0.363,0.103,0.605,108.004,audio_features,0bx6v84HtmEYFRBAOvDTgk,spotify:track:0bx6v84HtmEYFRBAOvDTgk,https://api.spotify.com/v1/tracks/0bx6v84HtmEYFRBAOvDTgk,https://api.spotify.com/v1/audio-analysis/0bx6v84HtmEYFRBAOvDTgk,234372,4,"Producers

How to Format Lyrics:
To learn more, check out our transcription guide or visit our transcribers forum
“Your Love (Déjà Vu),” described by band frontman Dave Bayley as a “conflicted booty-call anthem,” is about toxic relationships that you know are bad for you but can’t seem to cut off.
Speaking to Annie Mac during the song’s premiere on BBC Radio 1’s Future Sounds, the band’s lead singer and songwriter Dave Bayley explained that he has recently made a major shift from the band’s usual abstract lyrics to more personal ones. He went on to explain that “Your Love” is about a dysfunctional relationship and stated:
“[E]veryone’s got relationships, not necessarily romantic ones, in their lives and they know that that person is kind of bad; it’s an unhealthy relationship – but you keep letting that person back into your life. Either because you think it’s going to change, or because something deeper, darker – you’re addicted to the chaos of that relationship. That’s what this is about – being addicted to the mess.”
Naturally, much of this interview focused on the elephant in the room: drummer Joe Seaward’s life-threatening cycling accident which left him unable to walk or speak–much less play drums–for over a year. His injuries forced Glass Animals to cancel all scheduled tour dates and take an extended hiatus. Initially, the band stayed with him for several weeks. Eventually as Joe’s healing progressed Dave went to the United States where he worked on some solo and collaborative writing and producing projects. He said that working with hip-hop artists who tended to write very personal lyrics inspired him to take a more personal approach to songwriting as well. Thus, the incident that threatened to destroy the band ended up being a catalyst for creative change.
The song first made its live debut during Glass Animals' comeback show at The Bullingdon in late 2019 where the setlist called it “Palm Mute”. Fans in attendance reported that the band  requested for them not to post any videos of this performance online as they were still a bit rusty. They honored the request.
“Your Love (Déjà Vu)” was confirmed to be a single from Glass Animals' upcoming third album, Dreamland, before the album was officially announced.
Find answers to frequently asked questions about the song and explore its deeper meaning
Dave’s quotes in Dork Magazine expand on the song’s subject:
“I think we’ve all found ourselves in fucked up relationships that make us feel sad and helpless. Not necessarily something romantic – maybe it’s with a family member or a friend. A relationship that we know on some level is going to keep breaking our hearts. We let that person back into their [sic] lives over and over again, even though it always ends the same. Maybe you don’t confront it because you hope it’ll change with time. Or because it’s easier to let it slide and never set boundaries. maybe you think you deserve that unhappiness. Or maybe you find some strange comfort in the chaos.
This song is about that…about being addicted to chaos. About doing or allowing something self-destructive because on some level you get off on the sadness that comes of it. It’s about wanting to float around and exist inside of that feeling because it has always been familiar to you. It’s something that a lot of people know from growing up in a tense household…so it can feel right to create that dynamic, even if you don’t realise you’re doing it.”
Glass Animals explained it with a tweet
…it’s two identical takes. one with a thermal camera. one normal. layered on top of each other. i have a bath. and then i sit in a car even tho i don’t actually have a driving license. and we dance around.



"
7MAaZgT2QNnITEwOMQq9Ac,Melon and the Coconut,Glass Animals,2024-11-21T04:14:04.037Z,0.554,0.354,4,-15.02,1,0.0489,0.976,0.674,0.305,0.298,87.831,audio_features,7MAaZgT2QNnITEwOMQq9Ac,spotify:track:7MAaZgT2QNnITEwOMQq9Ac,https://api.spotify.com/v1/tracks/7MAaZgT2QNnITEwOMQq9Ac,https://api.spotify.com/v1/audio-analysis/7MAaZgT2QNnITEwOMQq9Ac,148706,4,"Producer

How to Format Lyrics:
To learn more, check out our transcription guide or visit our transcribers forum
“Melon and the Coconut” depicts a Melon and a Coconut breaking up with each other.
Bayley claims “I really like using food as characters. I think all food has a personality. someone’s favourite food says a lot about them.
After waking up from a nap, Bayley wrote and recorded this song in about an hour. Attempts were made to add more to it, however Bayley enjoyed the rawness of the song and felt adding more made it lose its charm.
When recording, Bayley accidentally left his security camera on and found himself with nearly two hours of footage of him playing around his studio. “I watched it back the other day,” he says. “I’m sitting there with my feet up playing the guitar and singing into a microphone. Maybe we need to cut that up for a video. I do some weird shit.”
Find answers to frequently asked questions about the song and explore its deeper meaning
Dave for Atwood Magazine:
I liked putting it in the middle ’cause it’s about these two characters, but really I’ve been both of those characters. I’ve been both of those places, kind of both sides of the argument. I don’t know. And then yeah, then you have the second half of the album. There’s something, I don’t know, symmetrical about that song ’cause it was one verse by the melon one verse by the… Yeah, anyway.
For Floor Magazine:
I just like how that one came out, just fast and really fun. There’s a spontaneous charm about it, and then we tried to fuck with it—like, put a big beat under it and stuff—and that didn’t really work, so we just left it in super demo form."
2MA6YoaFF7fnWqkuOAWjUg,Tokyo Drifting,"Glass Animals, Denzel Curry",2024-11-21T04:11:35.187Z,0.715,0.438,8,-9.874,0,0.0575,0.12,0.000139,0.107,0.418,128.905,audio_features,2MA6YoaFF7fnWqkuOAWjUg,spotify:track:2MA6YoaFF7fnWqkuOAWjUg,https://api.spotify.com/v1/tracks/2MA6YoaFF7fnWqkuOAWjUg,https://api.spotify.com/v1/audio-analysis/2MA6YoaFF7fnWqkuOAWjUg,216822,4,"Producers

How to Format Lyrics:
To learn more, check out our transcription guide or visit our transcribers forum
Find answers to frequently asked questions about the song and explore its deeper meaning"
0RZLmpEzGR2NHite6rvS5H,Space Ghost Coast To Coast,Glass Animals,2024-11-21T04:06:57.778Z,0.903,0.529,8,-9.901,1,0.0623,0.105,0.00255,0.138,0.353,100.977,audio_features,0RZLmpEzGR2NHite6rvS5H,spotify:track:0RZLmpEzGR2NHite6rvS5H,https://api.spotify.com/v1/tracks/0RZLmpEzGR2NHite6rvS5H,https://api.spotify.com/v1/audio-analysis/0RZLmpEzGR2NHite6rvS5H,187384,4,"Producer

How to Format Lyrics:
To learn more, check out our transcription guide or visit our transcribers forum
“Space Ghost Coast To Coast” combines bits and pieces of millennial childhood nostalgia with musings on school shootings. Frontman Dave Bayley explained to Flood and The Independent that the song was inspired by the fact that his childhood friend was caught attempting to plan a school shooting.
The band first began teasing the track along their 2020 Déjà Vu Tour, as seen on the setlist for one of the Boston show on the tour.
Find answers to frequently asked questions about the song and explore its deeper meaning
Dave Bayley wrote for the Apple Music Editor’s notes:
I’ve tried to tell this story somewhat vaguely because I hate the idea of revealing someone’s identity, and this person in particular has rebuilt themselves, which is an incredible thing. This song is about a very good friend I had growing up, back in those formative years when I was first discovering hip-hop—Eminem, Busta Rhymes, Missy Elliott, all of whom I tried to channel in the production—and also discovering myself. We went to camp together, we got into trouble together, but we were both always nervous and shy about everything. There was gentleness to it all. When my family moved to England, we fell out of touch, and a couple of years later I found out that he’d brought a gun to school and tried to do a shooting. He got caught on the way in, no one died, but it affected me. It didn’t add up in my head. He was the person I watched cartoons with and played kickball with… I couldn’t understand it. It was the first time I really understood how much things can change, that people you love can do things that you won’t understand. It was a breaking of innocence.
For Flood Magazine:
It’s when someone who you think you’ll always trust, even if you’re not in contact, does something that you think is unspeakably horrible and you can never forgive them. It’s thinking back on that, and how someone can change so much in such a short time."
0r9OkYadpBgYA2bkkrRSsI,Hot Sugar,Glass Animals,2024-11-21T04:03:36.495Z,0.705,0.487,0,-9.456,0,0.0587,0.0837,0.028,0.303,0.34,88.616,audio_features,0r9OkYadpBgYA2bkkrRSsI,spotify:track:0r9OkYadpBgYA2bkkrRSsI,https://api.spotify.com/v1/tracks/0r9OkYadpBgYA2bkkrRSsI,https://api.spotify.com/v1/audio-analysis/0r9OkYadpBgYA2bkkrRSsI,234866,4,"Producer

How to Format Lyrics:
To learn more, check out our transcription guide or visit our transcribers forum
“Hot Sugar” conveys the feelings of someone who thinks they’re falling in love for the first time, when in reality they just admire the other person’s cool persona. The narrator has fun with the laid back person, in an attempt to be cool like them, but ultimately they never engage in any real conversation.
There are various pop culture references in the song, along with the musical change up which was inspired by New Orleans Bounce music.
Find answers to frequently asked questions about the song and explore its deeper meaning
Dave for Atwood Magazine:
“Hot Sugar” is… I think that’s my favorite sonically, I wanted that one at the beginning of the record ’cause it is like… It’s all the sounds kind of coming together, all of the sounds of the record. It’s quite mad, lots of strings, lots of really noodle-y strings on the Mellotron. What can I tell you about that one? I guess that one’s actually about something that… About later in life, really. It’s about a relationship, I don’t know… It’s just admiring somebody and confusing that for love or being kind of in awe of someone and thinking that it’s love or… And going with the relationship for that reason, but really it’s just a kind of… You just kinda wanna be like that person ’cause they’re really cool. We’ve all been there. I don’t know, I think that was when I was like 15 or something. “This person’s so cool.” But really it’s just… Yeah, they dress cool, do cool things, and they make you do cool things.
And on Facebook:
“song explanation of the week….HOT SUGAR. what do y’all wanna know about this one? I dont want to go into too much depth….but loosely….the song is about confusing wishing you were more like someone, with being in love with them. this person is laid back, cool as hell, confident, they can pull off anything, dressed perfectly all the time, etc. and there i am i’m just like….quite neurotic. and you kind of want some elements of their ‘coolness’ to rub off on you. but at the same time you never feel fully comfortable around them. you never have real conversations with eachother. you spend a lot of time getting a bit messed up to try to fix that…and you have a lot of fun…but it aint right. so…there are a lot of bright visual references in this song to things that seem beautiful on the surface, but are either transient, or destined to fail, or deceptive, or lysergic-y/hallucination-y/not real. 
 ie the 70’s lotus esprit… its the ultimate like…little kid’s hotwheels dreamcar. it looks damn cool…but it was notorious for relentlessly breaking in minor ways. it could never actually complete a proper journey. [Also…it was used in a james bond movie (the spy who loved me) as a submarine car (awesome)].
 then there’s hotels, and spaceships being seen in the swimming pool but they’re actually just waves and cool whip that’s delicious but bad for you and the surfacey goodness of perfect skin and pricey perfume. 
 “pool paintings” is another nod to Hockney’s “bigger splash.” think i talked about that as a recurring theme in the dreamland explanation and how the album cover is a play on that painting with the pool and the trees and the diving board.
 the musical switch up came from having a phase of listening to a lot of bounce tunes.”"
49X0LAl6faAusYq02PRAY6,Lady - Hear Me Tonight,Modjo,2024-11-21T04:00:03.016Z,0.72,0.808,6,-5.627,1,0.0379,0.00793,0.0293,0.0634,0.869,126.041,audio_features,49X0LAl6faAusYq02PRAY6,spotify:track:49X0LAl6faAusYq02PRAY6,https://api.spotify.com/v1/tracks/49X0LAl6faAusYq02PRAY6,https://api.spotify.com/v1/audio-analysis/49X0LAl6faAusYq02PRAY6,307154,4,"Producers

How to Format Lyrics:
To learn more, check out our transcription guide or visit our transcribers forum
The debut single from Modjo is also their best known track, taking the UK by storm by leaping straight in at #1, as well as reaching the top ten in more than ten other countries. Coming back into the public conscious by appearing in Grand Theft Auto V, the French duo’s signature song shows no signs of going away.

Find answers to frequently asked questions about the song and explore its deeper meaning
“Lady” sampled Chic’s 1982 single “Soup For One”, which was unsuccessful at the time. Chic frontman Nile Rodgers later said:
It was amazing to me that someone could make a hit out of “Soup For One.” We thought it was a great record at the time, but you know when you do a record and it’s not having it and you think it’s your fault. But then Modjo did “Lady” and it was the bomb."
40rOlDoGejXXF4B0BYsjx8,Tangerine,Glass Animals,2024-11-21T03:59:34.238Z,0.845,0.583,9,-5.948,0,0.0773,0.114,0.000536,0.1,0.842,149.941,audio_features,40rOlDoGejXXF4B0BYsjx8,spotify:track:40rOlDoGejXXF4B0BYsjx8,https://api.spotify.com/v1/tracks/40rOlDoGejXXF4B0BYsjx8,https://api.spotify.com/v1/audio-analysis/40rOlDoGejXXF4B0BYsjx8,200584,4,"Producer

How to Format Lyrics:
To learn more, check out our transcription guide or visit our transcribers forum
Tangerine is the second track from Glass Animals' third studio album Dreamland.
The song features Dave singing over a very poppy and cheery instrumental mixed in with the enthusiastic “Woahs” of children, in contrast to the content of the song which reflects the experience of a person who loved someone that has now changed for the worse.
The title of the song comes from the properties of the fruit it is named after. According to Dave Bayley:
The idea of the tangerine is that it’s developed thick bitter skin that tastes like shit. Maybe there’s something nice hidden inside but if you leave it too long the skin just gets harder and more withered and the sweetness inside dries up.
In this context, a tangerine is compared to the one being talked about in the song. A thick, bitter peel, concealing a juicy fruit- but if it’s left alone for too long, all that niceness inside is going to dry up, and you’re left with just the bitterness.
Find answers to frequently asked questions about the song and explore its deeper meaning
Dave Bayley told FLOOD Magazine that:
“It’s about when someone you’ve known and loved for a long time begins to change for one reason or another, but you can still see those tangerine dots in their eyes from time to time, a glimmer of who they used to be. “Maybe it’s something they say or do. So you keep being attached to this person, this old version of the person that’s actually kind of a wanker now.”"
2LiDZmGERLzjrtBTCofj2G,Dreamland,Glass Animals,2024-11-21T03:56:13.507Z,0.253,0.352,8,-11.509,1,0.0357,0.883,0.00191,0.0668,0.099,141.97,audio_features,2LiDZmGERLzjrtBTCofj2G,spotify:track:2LiDZmGERLzjrtBTCofj2G,https://api.spotify.com/v1/tracks/2LiDZmGERLzjrtBTCofj2G,https://api.spotify.com/v1/audio-analysis/2LiDZmGERLzjrtBTCofj2G,203492,5,"Producer

How to Format Lyrics:
To learn more, check out our transcription guide or visit our transcribers forum
“Dreamland” is the title track and third single from Glass Animals' third studio album, Dreamland. The song features Dave singing over a slow, dreamy instrumental reminiscing about things that have happened in his life and listing topics that will be covered in the album’s other songs. Lead singer/lyricist Dave Bayley described the song as being like “a table of contents for the album as a whole”
The lyrics for the track were first previewed on the band’s website opensource.glassanimals.com, where they were displayed under a “file” called “lyrics.txt.” The album’s title was also announced within this song.
Find answers to frequently asked questions about the song and explore its deeper meaning
In an Instagram post promoting the song and announcing the upcoming album, Dave explained:
So…here is the title track, and a video I made for it in my house. Each line asks a question that’s explored in a later song. It’s not a banging single (the next one we’ll drop slaps!) but the words here could be considered a table of contents for the album as a whole. A little peek into what’s coming. I put every ounce of my soul into this album. It’s the most ambitious and challenging thing we’ve done by a distance. The album is called Dreamland, it lands on July 10th, and I can’t wait for you all to hear it. Love, Dave x"
49X0LAl6faAusYq02PRAY6,Lady - Hear Me Tonight,Modjo,2024-11-20T00:50:22.818Z,0.72,0.808,6,-5.627,1,0.0379,0.00793,0.0293,0.0634,0.869,126.041,audio_features,49X0LAl6faAusYq02PRAY6,spotify:track:49X0LAl6faAusYq02PRAY6,https://api.spotify.com/v1/tracks/49X0LAl6faAusYq02PRAY6,https://api.spotify.com/v1/audio-analysis/49X0LAl6faAusYq02PRAY6,307154,4,"Producers

How to Format Lyrics:
To learn more, check out our transcription guide or visit our transcribers forum
The debut single from Modjo is also their best known track, taking the UK by storm by leaping straight in at #1, as well as reaching the top ten in more than ten other countries. Coming back into the public conscious by appearing in Grand Theft Auto V, the French duo’s signature song shows no signs of going away.

Find answers to frequently asked questions about the song and explore its deeper meaning
“Lady” sampled Chic’s 1982 single “Soup For One”, which was unsuccessful at the time. Chic frontman Nile Rodgers later said:
It was amazing to me that someone could make a hit out of “Soup For One.” We thought it was a great record at the time, but you know when you do a record and it’s not having it and you think it’s your fault. But then Modjo did “Lady” and it was the bomb."
1eyzqe2QqGZUmfcPZtrIyt,Midnight City,M83,2024-11-19T23:49:48.654Z,0.526,0.712,11,-6.525,0,0.0356,0.0161,0.0,0.179,0.32,105.009,audio_features,1eyzqe2QqGZUmfcPZtrIyt,spotify:track:1eyzqe2QqGZUmfcPZtrIyt,https://api.spotify.com/v1/tracks/1eyzqe2QqGZUmfcPZtrIyt,https://api.spotify.com/v1/audio-analysis/1eyzqe2QqGZUmfcPZtrIyt,241440,4,"Producers

How to Format Lyrics:
To learn more, check out our transcription guide or visit our transcribers forum
“Midnight City” is off of M83’s sixth, and critically acclaimed album Hurry Up, We’re Dreaming (Naive, 2011). The song’s catchiness quickly made it one of the most popular songs of the year, appearing on the top of many “Best of” lists. The song is a tribute to city life and the city itself, especially how it comes alive during the nighttime.
Anthony Gonzalez’s comment on the use of the saxophone:
Sometimes a song needs an element to be finished. You know that this element has been overused in the past and is considered clichéd or cheesy, but the song needs it. With this album, the whole idea was to do something and have no regrets.
The music video is a tribute to the movies Village of the Damned and Close Encounters of the Third Kind.
Find answers to frequently asked questions about the song and explore its deeper meaning"
2K7xn816oNHJZ0aVqdQsha,Softcore,The Neighbourhood,2024-11-19T23:45:39.871Z,0.575,0.568,9,-5.509,0,0.03,0.0484,0.000417,0.286,0.37,93.986,audio_features,2K7xn816oNHJZ0aVqdQsha,spotify:track:2K7xn816oNHJZ0aVqdQsha,https://api.spotify.com/v1/tracks/2K7xn816oNHJZ0aVqdQsha,https://api.spotify.com/v1/audio-analysis/2K7xn816oNHJZ0aVqdQsha,206280,4,"Producer

How to Format Lyrics:
To learn more, check out our transcription guide or visit our transcribers forum
“Softcore” is the fifth track on The Neighbourhood’s self-titled third studio album The Neighbourhood.
The track blends a punchy electronic beat with 80s new wave synths to create a catchy, bad-ass alternative pop song. The bridge brings back the familiar chords and guitar progression heard in the second half of “Wiped Out!,” the title track of their sophomore album. Notably, “Softcore” would regain popularity in 2022, after going viral on the social media app TikTok.
Find answers to frequently asked questions about the song and explore its deeper meaning
“Softcore” was certified gold by the RIAA on May 17, 2022."
3SAga35lAPYdjj3qyfEsCF,Feel It - From The Original Series “Invincible”,d4vd,2024-11-16T09:04:16.176Z,0.565,0.593,8,-5.864,1,0.0883,0.0288,0.0,0.215,0.429,120.509,audio_features,3SAga35lAPYdjj3qyfEsCF,spotify:track:3SAga35lAPYdjj3qyfEsCF,https://api.spotify.com/v1/tracks/3SAga35lAPYdjj3qyfEsCF,https://api.spotify.com/v1/audio-analysis/3SAga35lAPYdjj3qyfEsCF,157974,4,
69uxyAqqPIsUyTO8txoP2M,Adventure of a Lifetime,Coldplay,2024-11-16T08:06:45.304Z,0.638,0.924,7,-3.887,1,0.036,0.00205,0.000175,0.149,0.53,111.995,audio_features,69uxyAqqPIsUyTO8txoP2M,spotify:track:69uxyAqqPIsUyTO8txoP2M,https://api.spotify.com/v1/tracks/69uxyAqqPIsUyTO8txoP2M,https://api.spotify.com/v1/audio-analysis/69uxyAqqPIsUyTO8txoP2M,263787,4,"Producers

How to Format Lyrics:
To learn more, check out our transcription guide or visit our transcribers forum
The groovy fifth track on Coldplay’s dynamic A Head Full of Dreams takes a step into disco, with a simplistic song about life and love, backed by a funky dance floor beat. It features a prominent guitar riff that was inspired by the riff on Guns N' Roses “Sweet Child O' Mine.”
According to bassist Guy Berryman,
[The track] started as a freeform musical session and was called something else, Legends or something. It had a different chord sequence and different hooks and one-by-one things were taken away and things got added.

Find answers to frequently asked questions about the song and explore its deeper meaning
The apes are computer graphics representations of Coldplay’s band members. To create the video, they went through an extensive motion capture process in The Volume, the same space used for James Cameron’s 2009 film Avatar.

According to bassist Guy Berryman,
[The track] started as a freeform musical session and was called something else, Legends or something. It had a different chord sequence and different hooks and one-by-one things were taken away and things got added.
According to Songfacts, SiriusXM’s Jeff Regan, Chris Martin explained the inspiration for the song:
I’d been begging Jonny our guitarist for years to make a riff that I like as much as “Sweet Child O' Mine“ by Guns N' Roses, then he showed me that one, and I was like, ‘That’s it’. So those elements all came together, and we just wanted to kind of embrace our love of joyful music and sort of let it free."
